{
  "specVersion": "recipes-import-v1",
  "batchId": "2026-03-batch-02",
  "generatedAt": "2026-03-30T18:30:00Z",
  "generator": {
    "provider": "gemini",
    "model": "gemini-2.5-flash",
    "notes": "lote vegetariano"
  },
  "recipes": [
    {
      "externalId": "batch02-receta-001",
      "name": "Tofu salteado con brócoli y cacahuetes",
      "nameEn": "Stir-fry Tofu with Broccoli and Peanuts",
      "description": "Un salteado asiático rico en proteína vegetal y grasas saludables.",
      "instructions": [
        "Prensar el tofu para eliminar el exceso de agua y cortarlo en dados.",
        "Saltear el tofu en una sartén con aceite hasta que esté dorado.",
        "Añadir el brócoli y los cacahuetes, cocinar 5 minutos más con salsa de soja."
      ],
      "prepTime": 15,
      "cookTime": 10,
      "servings": 1,
      "difficulty": "facil",
      "calories": 420,
      "protein": 32,
      "carbs": 18,
      "fat": 24,
      "fiber": 6,
      "imageUrl": null,
      "tags": ["almuerzo", "tofu", "salteado", "alta_proteina"],
      "mealTypes": ["almuerzo"],
      "dietTypes": ["alta_proteina", "mediterranea"],
      "goalTypes": ["recomposicion", "ganancia_muscular"],
      "ingredients": [
        { "name": "tofu firme", "quantity": 200, "unit": "g" },
        { "name": "brócoli", "quantity": 150, "unit": "g" },
        { "name": "cacahuetes naturales", "quantity": 20, "unit": "g" }
      ]
    },
    {
      "externalId": "batch02-receta-002",
      "name": "Tempeh marinado con calabaza al horno",
      "nameEn": "Marinated Tempeh with Roasted Pumpkin",
      "description": "Tempeh fermentado con un toque dulce de calabaza asada.",
      "instructions": [
        "Marinar el tempeh con ajo y jengibre durante 15 minutos.",
        "Colocar en una bandeja junto a la calabaza troceada.",
        "Hornear a 200°C durante 20 minutos hasta que estén tiernos."
      ],
      "prepTime": 20,
      "cookTime": 20,
      "servings": 1,
      "difficulty": "medio",
      "calories": 450,
      "protein": 30,
      "carbs": 35,
      "fat": 22,
      "fiber": 9,
      "imageUrl": null,
      "tags": ["cena", "tempeh", "horno", "alta_proteina"],
      "mealTypes": ["cena"],
      "dietTypes": ["alta_proteina", "mediterranea"],
      "goalTypes": ["ganancia_muscular", "mantenimiento"],
      "ingredients": [
        { "name": "tempeh", "quantity": 150, "unit": "g" },
        { "name": "calabaza", "quantity": 200, "unit": "g" },
        { "name": "aceite de oliva", "quantity": 1, "unit": "cucharada" }
      ]
    },
    {
      "externalId": "batch02-receta-003",
      "name": "Garbanzos con espinacas y huevo poché",
      "nameEn": "Chickpeas with Spinach and Poached Egg",
      "description": "Un plato tradicional de legumbre, equilibrado y saciante.",
      "instructions": [
        "Saltear las espinacas con un diente de ajo picado.",
        "Añadir los garbanzos cocidos y pimentón al gusto.",
        "Servir con un huevo poché encima para añadir cremosidad."
      ],
      "prepTime": 5,
      "cookTime": 10,
      "servings": 1,
      "difficulty": "facil",
      "calories": 380,
      "protein": 22,
      "carbs": 42,
      "fat": 15,
      "fiber": 11,
      "imageUrl": null,
      "tags": ["almuerzo", "legumbre", "huevo", "hierro"],
      "mealTypes": ["almuerzo", "cena"],
      "dietTypes": ["mediterranea"],
      "goalTypes": ["perdida_peso", "salud_cardiometabolica"],
      "ingredients": [
        { "name": "garbanzos cocidos", "quantity": 180, "unit": "g" },
        { "name": "espinacas frescas", "quantity": 150, "unit": "g" },
        { "name": "huevo", "quantity": 1, "unit": "unidad" }
      ]
    },
    {
      "externalId": "batch02-receta-004",
      "name": "Tostada de aguacate, requesón y semillas",
      "nameEn": "Avocado, Ricotta and Seed Toast",
      "description": "Desayuno salado con grasas monoinsaturadas y proteínas lácteas.",
      "instructions": [
        "Tostar la rebanada de pan integral.",
        "Untar el requesón y colocar el aguacate laminado encima.",
        "Espolvorear con semillas de chía y una pizca de sal."
      ],
      "prepTime": 5,
      "cookTime": 2,
      "servings": 1,
      "difficulty": "facil",
      "calories": 310,
      "protein": 14,
      "carbs": 28,
      "fat": 16,
      "fiber": 8,
      "imageUrl": null,
      "tags": ["desayuno", "aguacate", "salado"],
      "mealTypes": ["desayuno"],
      "dietTypes": ["mediterranea"],
      "goalTypes": ["mantenimiento", "salud_cardiometabolica"],
      "ingredients": [
        { "name": "pan integral", "quantity": 1, "unit": "rebanada" },
        { "name": "aguacate", "quantity": 0.5, "unit": "unidad" },
        { "name": "requesón", "quantity": 50, "unit": "g" },
        { "name": "semillas de chía", "quantity": 1, "unit": "cucharadita" }
      ]
    },
    {
      "externalId": "batch02-receta-005",
      "name": "Ensalada de lentejas beluga con feta",
      "nameEn": "Beluga Lentil Salad with Feta",
      "description": "Ensalada fría de legumbres ideal para llevar al trabajo.",
      "instructions": [
        "Mezclar las lentejas cocidas con tomate, pepino y cebolla tierna.",
        "Añadir el queso feta en dados y aceitunas.",
        "Aliñar con una vinagreta de limón y orégano."
      ],
      "prepTime": 10,
      "cookTime": 0,
      "servings": 1,
      "difficulty": "facil",
      "calories": 390,
      "protein": 21,
      "carbs": 45,
      "fat": 14,
      "fiber": 12,
      "imageUrl": null,
      "tags": ["almuerzo", "legumbre", "ensalada_completa", "feta"],
      "mealTypes": ["almuerzo"],
      "dietTypes": ["mediterranea"],
      "goalTypes": ["perdida_peso", "mantenimiento"],
      "ingredients": [
        { "name": "lentejas beluga cocidas", "quantity": 150, "unit": "g" },
        { "name": "queso feta", "quantity": 30, "unit": "g" },
        { "name": "tomate", "quantity": 1, "unit": "unidad" }
      ]
    },
    {
      "externalId": "batch02-receta-006",
      "name": "Bowl de tempeh teriyaki y quinoa",
      "nameEn": "Teriyaki Tempeh and Quinoa Bowl",
      "description": "Bowl completo con proteína fermentada y pseudocereal.",
      "instructions": [
        "Cocinar la quinoa siguiendo las instrucciones del paquete.",
        "Saltear el tempeh con salsa teriyaki baja en azúcar.",
        "Montar el bowl con quinoa, tempeh, zanahoria rallada y rabanitos."
      ],
      "prepTime": 15,
      "cookTime": 15,
      "servings": 1,
      "difficulty": "facil",
      "calories": 480,
      "protein": 28,
      "carbs": 52,
      "fat": 18,
      "fiber": 10,
      "imageUrl": null,
      "tags": ["bowl", "tempeh", "quinoa", "alta_proteina"],
      "mealTypes": ["almuerzo"],
      "dietTypes": ["alta_proteina", "mediterranea"],
      "goalTypes": ["recomposicion", "ganancia_muscular"],
      "ingredients": [
        { "name": "tempeh", "quantity": 120, "unit": "g" },
        { "name": "quinoa cocida", "quantity": 150, "unit": "g" },
        { "name": "zanahoria", "quantity": 50, "unit": "g" }
      ]
    },
    {
      "externalId": "batch02-receta-007",
      "name": "Crema de alubias blancas y puerro",
      "nameEn": "White Bean and Leek Cream",
      "description": "Una crema suave y proteica gracias a las legumbres trituradas.",
      "instructions": [
        "Pochar el puerro con un poco de aceite de oliva.",
        "Añadir las alubias cocidas y caldo de verduras; dejar hervir 5 minutos.",
        "Triturar hasta obtener una textura fina y servir caliente."
      ],
      "prepTime": 10,
      "cookTime": 15,
      "servings": 1,
      "difficulty": "facil",
      "calories": 320,
      "protein": 18,
      "carbs": 40,
      "fat": 9,
      "fiber": 12,
      "imageUrl": null,
      "tags": ["cena", "crema", "legumbre", "digestivo"],
      "mealTypes": ["cena"],
      "dietTypes": ["mediterranea"],
      "goalTypes": ["perdida_peso", "salud_cardiometabolica"],
      "ingredients": [
        { "name": "alubias blancas cocidas", "quantity": 200, "unit": "g" },
        { "name": "puerro", "quantity": 1, "unit": "unidad" },
        { "name": "caldo de verduras", "quantity": 200, "unit": "ml" }
      ]
    },
    {
      "externalId": "batch02-receta-008",
      "name": "Tofu revuelto con cúrcuma y espinacas",
      "nameEn": "Turmeric Tofu Scramble with Spinach",
      "description": "Alternativa vegana al revuelto de huevo, ideal para empezar el día.",
      "instructions": [
        "Desmigar el tofu con las manos o un tenedor.",
        "Saltear con cúrcuma, sal negra y espinacas hasta que reduzcan.",
        "Servir sobre pan integral tostado."
      ],
      "prepTime": 5,
      "cookTime": 10,
      "servings": 1,
      "difficulty": "facil",
      "calories": 340,
      "protein": 26,
      "carbs": 25,
      "fat": 15,
      "fiber": 7,
      "imageUrl": null,
      "tags": ["desayuno", "tofu", "alta_proteina", "vegano"],
      "mealTypes": ["desayuno"],
      "dietTypes": ["alta_proteina", "mediterranea"],
      "goalTypes": ["recomposicion", "mantenimiento"],
      "ingredients": [
        { "name": "tofu firme", "quantity": 180, "unit": "g" },
        { "name": "espinacas frescas", "quantity": 100, "unit": "g" },
        { "name": "pan integral", "quantity": 1, "unit": "rebanada" },
        { "name": "cúrcuma", "quantity": 1, "unit": "cucharadita" }
      ]
    },
    {
      "externalId": "batch02-receta-009",
      "name": "Wrap de hummus y vegetales asados",
      "nameEn": "Hummus and Roasted Vegetable Wrap",
      "description": "Comida rápida y saludable cargada de fibra y sabor.",
      "instructions": [
        "Extender el hummus sobre la tortilla integral.",
        "Añadir pimientos y berenjenas asados previamente.",
        "Enrollar y dorar ligeramente en la sartén antes de servir."
      ],
      "prepTime": 10,
      "cookTime": 5,
      "servings": 1,
      "difficulty": "facil",
      "calories": 410,
      "protein": 15,
      "carbs": 55,